{
  "$schema": "https://json-schema.org/draft/2020-12/schema",
  "$id": "urn:lfgranja:livingroots:never-quarantine:v1",
  "$comment": "CODEOWNERS-gated registry of scenarios/classes that must never be quarantined (C-REL-23). The file is committed at specs/010-headless-verification-runner/never-quarantine.json. Automation may never add, remove, or weaken an entry; every change requires maintainer review. 'classes' is a CLOSED set: minItems and maxItems both equal the enum length so exactly the full set is required, and any addition is a schema major bump. A matching scenario is never a quarantine candidate; deterministic 100%-failing scenarios are regressions to bisect, and security/integrity failures are never quarantinable or demotable.",
  "title": "Living Roots Never-Quarantine Registry",
  "description": "Machine-readable closed set of failure classes and critical-path scenarios that are never eligible for quarantine. Draft 2020-12, strict objects, immutable versioned $id.",
  "type": "object",
  "additionalProperties": false,
  "required": [
    "schemaVersion",
    "classes",
    "criticalPathScenarios",
    "updatedAt",
    "owner"
  ],
  "properties": {
    "schemaVersion": {
      "const": 1,
      "title": "Schema version",
      "description": "Registry payload version. v1 is the first published version and is immutable.",
      "examples": [
        1
      ]
    },
    "classes": {
      "type": "array",
      "items": {
        "$ref": "#/$defs/neverQuarantineClass"
      },
      "minItems": 10,
      "maxItems": 10,
      "uniqueItems": true,
      "title": "Never-quarantinable failure classes",
      "description": "Closed set. Exactly all ten classes must be present. A matching run is a regression or security/integrity event, never flake.",
      "examples": [
        [
          "host-guard-breach",
          "version-mismatch",
          "missing-dependency",
          "threshold-violation",
          "crash",
          "incomplete-signals",
          "integrity-failure",
          "security-failure",
          "deterministic-regression",
          "claim-overreach"
        ]
      ]
    },
    "criticalPathScenarios": {
      "type": "array",
      "items": {
        "$ref": "#/$defs/criticalPathScenario"
      },
      "uniqueItems": true,
      "title": "Critical-path scenarios",
      "description": "Every scenario tagged criticalPath: true in its scenario definition. These are never quarantinable regardless of flake history.",
      "examples": [
        [
          {
            "scenarioId": "save-load-round-trip",
            "featureSlug": "009-end-to-end-game-verification",
            "reason": "Save/load round-trip is a critical-path coverage class."
          }
        ]
      ]
    },
    "updatedAt": {
      "type": "string",
      "pattern": "^[0-9]{4}-[0-9]{2}-[0-9]{2}T[0-9]{2}:[0-9]{2}:[0-9]{2}Z$",
      "title": "Updated at",
      "description": "ISO 8601 UTC timestamp of the last reviewed change.",
      "examples": [
        "2026-10-27T12:00:00Z"
      ]
    },
    "owner": {
      "type": "string",
      "pattern": "^[A-Za-z0-9][A-Za-z0-9-]*$",
      "title": "Owner",
      "description": "CODEOWNERS handle accountable for the registry.",
      "examples": [
        "lfgranja"
      ]
    }
  },
  "$defs": {
    "neverQuarantineClass": {
      "type": "string",
      "enum": [
        "host-guard-breach",
        "version-mismatch",
        "missing-dependency",
        "threshold-violation",
        "crash",
        "incomplete-signals",
        "integrity-failure",
        "security-failure",
        "deterministic-regression",
        "claim-overreach"
      ],
      "title": "Never-quarantinable class",
      "description": "Closed vocabulary. host-guard-breach, version-mismatch, missing-dependency, threshold-violation, crash, and incomplete-signals (the partial verdict class) come from C-REL-23; integrity-failure and security-failure cover FR-024/FR-025; deterministic-regression covers deterministic 100%-failing scenarios; claim-overreach covers honesty/claim violations (policy, exit 21)."
    },
    "scenarioId": {
      "type": "string",
      "minLength": 1,
      "maxLength": 100,
      "pattern": "^[a-z0-9][a-z0-9-]*$",
      "title": "Scenario identifier",
      "description": "Stable kebab-case scenario identifier, matching scenario.schema.json."
    },
    "criticalPathScenario": {
      "type": "object",
      "additionalProperties": false,
      "required": [
        "scenarioId",
        "featureSlug"
      ],
      "title": "Critical-path scenario entry",
      "properties": {
        "scenarioId": {
          "$ref": "#/$defs/scenarioId"
        },
        "featureSlug": {
          "type": "string",
          "minLength": 1,
          "maxLength": 100,
          "pattern": "^[0-9]{3}-[a-z0-9-]+$",
          "title": "Feature slug",
          "description": "Feature folder under specs/ (NNN-slug)."
        },
        "reason": {
          "type": "string",
          "minLength": 1,
          "maxLength": 500,
          "title": "Reason",
          "description": "Why this scenario is critical-path; advisory but strongly recommended."
        }
      }
    }
  }
}
