{
  "schemaVersion": 1,
  "classes": [
    "host-guard-breach",
    "version-mismatch",
    "missing-dependency",
    "threshold-violation",
    "crash",
    "incomplete-signals",
    "integrity-failure",
    "security-failure",
    "deterministic-regression",
    "claim-overreach"
  ],
  "criticalPathScenarios": [
    {
      "scenarioId": "compost-growth-poor-soil",
      "featureSlug": "004-playable-compost-loop",
      "reason": "Core compost-to-growth threshold evaluation on poor soil; a regression is a deterministic defect, never flake."
    }
  ],
  "updatedAt": "2026-10-27T12:00:00Z",
  "owner": "lfgranja"
}
